{
  "modelVersion": "3.0.0",
  "frameworkEdition": "FinOps Framework 2026 (published 19 Mar 2026) [CLM-FIN-003]: four domains [CLM-FIN-002] and 22 capabilities [CLM-FIN-010]; phases (Inform, Optimize, Operate) and principles are shown as context, not scored [CLM-FIN-007]",
  "statusAsOf": "2026-10-14",
  "attribution": {
    "text": "Adapted from the FinOps Framework by the FinOps Foundation [CLM-FIN-001, CLM-FIN-033].",
    "licence": "CC BY 4.0",
    "sourceUrl": "https://www.finops.org/framework/",
    "changes": "LTM rates each capability per scope with its own question sets, adds 'Not yet' and 'Unknown' ratings, sets default targets by complexity tier (LTM heuristics) and computes no organisation-level stage. Descriptions and maturity guidance are LTM's wording, not quotations. Not endorsed by the FinOps Foundation; not a FinOps Foundation assessment or certification [CLM-FIN-033].",
    "noEndorsement": true
  },
  "maturityScale": [
    {
      "rating": "not_yet",
      "index": 0,
      "meaning": "The capability is not performed in any deliberate way.",
      "ltmAddition": true,
      "claimIds": [
        "CLM-FIN-005"
      ]
    },
    {
      "rating": "crawl",
      "index": 1,
      "meaning": "Basic processes and KPIs, little reporting or tooling; not yet followed by all major teams; focus on easy wins (LTM paraphrase).",
      "claimIds": [
        "CLM-FIN-004",
        "CLM-FIN-005"
      ]
    },
    {
      "rating": "walk",
      "index": 2,
      "meaning": "Understood and followed within the organisation; automation and processes cover most requirements; some difficult edge cases still open (LTM paraphrase).",
      "claimIds": [
        "CLM-FIN-004",
        "CLM-FIN-005"
      ]
    },
    {
      "rating": "run",
      "index": 3,
      "meaning": "Understood and followed by all relevant teams; edge cases handled; high KPIs; automation preferred (LTM paraphrase). Run is not the goal everywhere: the right level depends on the environment.",
      "claimIds": [
        "CLM-FIN-004",
        "CLM-FIN-005"
      ]
    },
    {
      "rating": "unknown",
      "index": 0,
      "meaning": "The respondent does not know. Counted as risk (gap as if Not yet) and flagged unconfirmed, with 'confirm' as the first action.",
      "ltmAddition": true,
      "claimIds": [
        "CLM-FIN-141"
      ]
    },
    {
      "rating": "not_in_scope",
      "index": null,
      "meaning": "Set only by scope facts, never by an answer.",
      "ltmAddition": true,
      "claimIds": [
        "CLM-FIN-006"
      ]
    },
    {
      "rating": "not_assessed",
      "index": null,
      "meaning": "No mapped question answered; counts as not at target and lowers coverage.",
      "ltmAddition": true,
      "claimIds": [
        "CLM-FIN-141"
      ]
    }
  ],
  "domains": [
    {
      "id": "D1",
      "name": "Understand Usage & Cost",
      "capabilities": [
        "DATA_INGESTION",
        "ALLOCATION",
        "REPORTING_ANALYTICS",
        "ANOMALY_MANAGEMENT"
      ]
    },
    {
      "id": "D2",
      "name": "Quantify Business Value",
      "capabilities": [
        "PLANNING_ESTIMATING",
        "FORECASTING",
        "BUDGETING",
        "KPIS_BENCHMARKING",
        "UNIT_ECONOMICS"
      ]
    },
    {
      "id": "D3",
      "name": "Optimize Usage & Cost",
      "capabilities": [
        "ARCHITECTING_WORKLOAD_PLACEMENT",
        "USAGE_OPTIMIZATION",
        "RATE_OPTIMIZATION",
        "LICENSING_SAAS",
        "SUSTAINABILITY"
      ]
    },
    {
      "id": "D4",
      "name": "Manage the FinOps Practice",
      "capabilities": [
        "EXECUTIVE_STRATEGY_ALIGNMENT",
        "FINOPS_PRACTICE_OPERATIONS",
        "GOVERNANCE_POLICY_RISK",
        "FINOPS_EDUCATION_ENABLEMENT",
        "INVOICING_CHARGEBACK",
        "FINOPS_ASSESSMENT",
        "AUTOMATION_TOOLS_SERVICES",
        "INTERSECTING_DISCIPLINES"
      ]
    }
  ],
  "capabilities": [
    {
      "id": "DATA_INGESTION",
      "domain": "D1",
      "displayName": "Data Ingestion",
      "displayNameStatus": "V",
      "relevance": "always",
      "description": "Collect cost, usage and related data from every account, provider and on-premises source into one store the organisation controls, completely and on time.",
      "defaultTargets": {
        "tier1": "walk",
        "tier2": "walk",
        "tier3": "run",
        "assumptionId": "ASM-FIN-004",
        "runReason": "Everything else depends on complete, timely data"
      },
      "questions": [
        {
          "id": "UN-01",
          "role": "core"
        },
        {
          "id": "UN-02",
          "role": "scope_conditional"
        },
        {
          "id": "UN-03",
          "role": "core"
        }
      ],
      "maturityGuidance": {
        "notYet": "Cost is seen only in provider consoles.",
        "crawl": "Some accounts exported, or data downloaded by hand.",
        "walk": "All major accounts exported automatically; known gaps are listed.",
        "run": "All accounts at least daily in a common schema (for example FOCUS) with completeness checks; private cloud and data centre costs in the same model.",
        "source": "ltm_paraphrase",
        "claimIds": [
          "CLM-FIN-008",
          "CLM-FIN-005"
        ]
      },
      "offeringIds": [
        "OFF.FIN.TOOLING",
        "OFF.FIN.ASSESS"
      ],
      "costIqPrefill": [
        "CIQ.FIN-01"
      ],
      "wave": 1,
      "claimIds": [
        "CLM-FIN-011",
        "CLM-FIN-008",
        "CLM-FIN-080"
      ],
      "basis": [
        {
          "claimId": "CLM-FIN-011",
          "citation": "FinOps Framework capability 'Data Ingestion', adapted under CC BY 4.0 [CLM-FIN-011]",
          "status": "V"
        },
        {
          "assumptionId": "ASM-FIN-004",
          "citation": "LTM default targets by complexity tier (DESIGN.md 3.4) [CLM-FIN-121]",
          "status": "LTM_heuristic",
          "claimId": "CLM-FIN-121"
        },
        {
          "claimId": "CLM-FIN-008",
          "citation": "FOCUS 1.4 ratified 4 Jun 2026 [CLM-FIN-008]",
          "status": "V"
        },
        {
          "claimId": "CLM-FIN-080",
          "citation": "AWS Data Exports: CUR 2.0 and FOCUS 1.2 [CLM-FIN-080]",
          "status": "V"
        }
      ]
    },
    {
      "id": "ALLOCATION",
      "domain": "D1",
      "displayName": "Allocation",
      "displayNameStatus": "V",
      "relevance": "always",
      "description": "Assign every cost to an accountable owner (team, product or cost centre) using account structure, tags or labels and rules for shared costs, measured by cost.",
      "defaultTargets": {
        "tier1": "crawl",
        "tier2": "walk",
        "tier3": "run",
        "assumptionId": "ASM-FIN-004",
        "runReason": "Unallocated spend cannot be owned, charged back or unit-costed"
      },
      "questions": [
        {
          "id": "UN-04",
          "role": "core",
          "executive": true
        },
        {
          "id": "UN-05",
          "role": "core"
        },
        {
          "id": "UN-09",
          "role": "scope_conditional"
        }
      ],
      "maturityGuidance": {
        "notYet": "Below 70% of spend allocated by cost, or not measured; no allocation policy.",
        "crawl": "70-84% of spend allocated; informal conventions.",
        "walk": "85-90% allocated under a documented policy that is mostly applied.",
        "run": "More than 90% allocated; owners for every account; shared and container costs allocated by rule and reconciled to the bill.",
        "source": "ltm_paraphrase",
        "claimIds": [
          "CLM-FIN-035",
          "CLM-FIN-124",
          "CLM-FIN-005"
        ]
      },
      "offeringIds": [
        "OFF.FIN.TOOLING",
        "OFF.FIN.OPMODEL"
      ],
      "costIqPrefill": [
        "CIQ.FIN-07"
      ],
      "wave": 1,
      "claimIds": [
        "CLM-FIN-012",
        "CLM-FIN-124",
        "CLM-FIN-035"
      ],
      "basis": [
        {
          "claimId": "CLM-FIN-012",
          "citation": "FinOps Framework capability 'Allocation', adapted under CC BY 4.0 [CLM-FIN-012]",
          "status": "V"
        },
        {
          "assumptionId": "ASM-FIN-004",
          "citation": "LTM default targets by complexity tier (DESIGN.md 3.4) [CLM-FIN-121]",
          "status": "LTM_heuristic",
          "claimId": "CLM-FIN-121"
        },
        {
          "claimId": "CLM-FIN-124",
          "assumptionId": "ASM-FIN-020",
          "citation": "Allocation bands adopt the Foundation's sample goals (70 / 85 / >90%) [CLM-FIN-124, CLM-FIN-035]",
          "status": "S"
        },
        {
          "claimId": "CLM-FIN-035",
          "citation": "FinOps Foundation sample allocation goals [CLM-FIN-035]",
          "status": "S"
        }
      ]
    },
    {
      "id": "REPORTING_ANALYTICS",
      "domain": "D1",
      "displayName": "Reporting & Analytics",
      "displayNameStatus": "V",
      "relevance": "always",
      "description": "Give engineering, product and finance the cost views they need, ideally self-service and filtered to their scope, on a regular schedule.",
      "defaultTargets": {
        "tier1": "crawl",
        "tier2": "walk",
        "tier3": "run",
        "assumptionId": "ASM-FIN-004",
        "runReason": "Many consumers of cost data at this scale"
      },
      "questions": [
        {
          "id": "UN-07",
          "role": "core"
        },
        {
          "id": "UN-08",
          "role": "core"
        }
      ],
      "maturityGuidance": {
        "notYet": "No regular cost visibility outside the central team.",
        "crawl": "Periodic reports on request; one or two report types.",
        "walk": "Self-service for some groups; three or four report types on schedule.",
        "run": "Self-service for engineering, product and finance; all five report types (cost by owner, forecast, anomalies, unit cost, commitment coverage and utilisation).",